<?xml version="1.0" encoding="UTF-8"?>
<!DOCTYPE seqopcodes SYSTEM "seqopcodes.dtd">
<!-- @generated by tools/toml_to_xml.py from conf/opcodes.toml.
     Edit opcodes.toml, not this file — your changes will be overwritten on next build. -->
<seqopcodes>
    <opcode id="2efb" name="OP_GuildList">
        <comment>GuildListCode - S>C ~14KB at login, full server guild roster (list of guild-name strings). Confirmed 2026-05-27 (login-charmgmt): inline guild names in a 14176b login packet.</comment>
        <payload dir="server" typename="worldGuildListStruct" sizechecktype="none"/>
    </opcode>
    <opcode id="f8e0" name="OP_MOTD">
        <comment>MOTDCode - server message of the day, S>C world-stream post-EnterWorld. Confirmed 2026-05-27 (login-charmgmt): 154b payload = readable MOTD text ("Greetings Norrathians! ...").</comment>
        <payload dir="server" typename="worldMOTDStruct" sizechecktype="none"/>
    </opcode>
    <opcode id="204f" name="OP_SendLoginInfo" updated="07/16/26">
        <comment>Client starting world session by asking for login information. Live: 464b C>S, first packet of every world session (5/5 confirmations).</comment>
    </opcode>
    <opcode id="b537" name="OP_LogServer" updated="07/16/26">
        <comment>Live candidate: S>C 24b (0x7f8e), fires immediately after OP_SendLoginInfo in the handshake band.</comment>
    </opcode>
    <opcode id="b8cc" name="OP_ApproveWorld" updated="07/16/26">
        <comment>Live candidate: small S>C in handshake band; not isolated yet.</comment>
    </opcode>
    <opcode id="0935" name="OP_EnterWorld" updated="07/16/26">
        <comment>Client tells world server to enter world with selected char. EQ Legends: 72b C>S, char name (zero-padded) at offset 0. Re-found 2026-07-16 after the 07/14 rotation left it unmapped (ffff): dump-payload of a 12-zone capture gave 0x0935 = 11×72B C>S (one per same-socket zone re-entry) + 11×5B S>C ack, and all 11 carry the SAME constant char-name @0 (NUL-term) — clinched. NOTE the trailer is no longer 0xffffffff (now a small value ~0x0b), so no struct is cast; the handler only needs the trigger. Prior ids 9bdc/26bf were stale pre-rotation guesses (never on the current wire). Mapping this makes NamePromoter fire on eql (matches by opcode name + 72b len), naming the box at the WORLD handshake — earlier than the own-spawn adoption fallback.</comment>
        <payload dir="client" typename="uint8_t" sizechecktype="none"/>
        <payload dir="server" typename="uint8_t" sizechecktype="none"/>
    </opcode>
    <opcode id="6bcf" name="OP_ExpansionInfo" updated="07/16/26">
        <comment>Which expansions user has. Live: 64b fixed S>C in the post-LogServer / pre-ApproveWorld handshake band (5/5 confirmations).</comment>
    </opcode>
    <opcode id="7fc9" name="OP_SendCharInfo" updated="07/16/26">
        <comment>Send all chars visible @ char select. Live: 14176b S>C (variable with character roster size), fires once early in world handshake.</comment>
    </opcode>
    <opcode id="2de1" name="OP_SendSpellChecksum" updated="07/16/26">
        <comment>Contains a snippet of spell data. Live: 2056b C>S, payload tail shows caret-delimited spell-data text (matches spells_us.txt format). Capture-order position 2 of 4 in the post-handshake checksum burst.</comment>
    </opcode>
    <opcode id="44d9" name="OP_SendExeChecksum" updated="07/16/26">
        <comment>Client-side eqgame.exe checksum sample. Live: 2056b C>S, payload tail shows binary code-style content. Capture-order position 1 of 4 in the post-handshake checksum burst.</comment>
    </opcode>
    <opcode id="289c" name="OP_SendBaseDataChecksum" updated="07/16/26">
        <comment>Client-side base-data file sample. Live: 2056b C>S, payload tail shows caret-delimited text records. Capture-order position 3 of 4 in the post-handshake checksum burst. Mapping to BaseData (vs another text-format file) inferred by elimination + position.</comment>
    </opcode>
    <opcode id="a958" name="OP_SendSkillCapsChecksum" updated="07/16/26">
        <comment>Client-side skillcaps checksum. Live: 64b C>S, opaque hash-style payload. Capture-order position 4 of 4 in the post-handshake checksum burst — the only one not at 2056b, fits the smaller skillcaps data table.</comment>
    </opcode>
    <opcode id="8eaa" name="OP_SetChatServer" updated="07/14/26">
        <comment>Legacy chatserver tuple. May be obsolete on Live — handshake capture shows only the SetChatServer2 catalog (no 56b S>C tuple observed, unlike Test).</comment>
    </opcode>
    <opcode id="f22b" name="OP_SetChatServer2" updated="07/16/26">
        <comment>Secondary chat / account / commerce service catalog. Live: 1464b S>C in handshake band (3/3 confirmations); ~18 plaintext Daybreak service URLs.</comment>
    </opcode>
    <opcode id="0861" name="OP_ZoneServerInfo" updated="07/14/26">
        <comment>Zone server connection info. Live: 130b S>C, fires on world->zone handoff (zone server hostname + port). 2/2 confirmations.</comment>
        <payload dir="server" typename="zoneServerInfoStruct" sizechecktype="match"/>
    </opcode>
    <opcode id="fc46" name="OP_WorldComplete" updated="07/16/26">
        <comment>Client telling world server it is done. Live: 0b C>S, last C>S packet of session immediately after OP_ZoneServerInfo. World replies by disconnecting. 2/2 confirmations.</comment>
    </opcode>
    <opcode id="48f9" name="OP_DeleteCharacter" updated="07/16/26">
        <comment>Delete character @ char select. Live: 68b C>S world, name@offset 0. Re-confirmed post-2026-05-22 patch (login-charmgmt): 1 C>S fire carrying the deleted char name.</comment>
    </opcode>
    <opcode id="08d0" name="OP_CharacterCreate" updated="07/16/26">
        <comment>Create character @ char select. Live: 168b C>S world (name[64] + gender/race/class/deity/appearance fields), fires once per submitted creation right after OP_ApproveName response. Re-confirmed post-2026-05-22 patch (login-charmgmt).</comment>
    </opcode>
    <opcode id="a24a" name="OP_ApproveName" updated="07/16/26">
        <comment>Approving new character name @ char creation. Live: 84b C>S name candidate, 1b S>C status (taken vs available). Re-confirmed post-2026-05-22 patch (login-charmgmt): fires right before OP_CharacterCreate.</comment>
    </opcode>
    <opcode id="ffff" name="OP_RandomNameGenerator">
        <comment>Returns a random name. May be obsolete on Live — repeated random-button presses during char creation produced no isolated wire request/response; names likely come pre-baked in char-select catalog dump.</comment>
    </opcode>
</seqopcodes>
