<?xml version="1.0" encoding="UTF-8"?>
<!DOCTYPE seqopcodes SYSTEM "seqopcodes.dtd">
<!-- @generated by tools/toml_to_xml.py from conf/opcodes.toml.
     Edit opcodes.toml, not this file — your changes will be overwritten on next build. -->
<seqopcodes>
    <opcode id="ffff" name="OP_GuildList">
        <comment>old GuildListCode. Live candidates from world handshake: S>C 1932b (0xeb30) early in handshake, or S>C 36805b (0x627f) catalog dump — needs payload inspection.</comment>
        <payload dir="server" typename="worldGuildListStruct" sizechecktype="none"/>
    </opcode>
    <opcode id="ffff" name="OP_MOTD">
        <comment>old MOTDCode Server message of the day. Live candidates: S>C 157b (0x08aa) or 1188b (0x0fe3); not yet payload-confirmed.</comment>
        <payload dir="server" typename="worldMOTDStruct" sizechecktype="none"/>
    </opcode>
    <opcode id="7b6a" name="OP_SendLoginInfo" updated="05/25/26">
        <comment>Client starting world session by asking for login information. Live: 464b C>S, first packet of every world session (5/5 confirmations).</comment>
    </opcode>
    <opcode id="b537" name="OP_LogServer" updated="05/25/26">
        <comment>Live candidate: S>C 24b (0x7f8e), fires immediately after OP_SendLoginInfo in the handshake band.</comment>
    </opcode>
    <opcode id="b8cc" name="OP_ApproveWorld" updated="05/25/26">
        <comment>Live candidate: small S>C in handshake band; not isolated yet.</comment>
    </opcode>
    <opcode id="9bdc" name="OP_EnterWorld" updated="05/25/26">
        <comment>Client tells world server to enter world with selected char. Live: 72b C>S, char name (zero-padded) at offset 0 + 64b zeros + 0xffffffff trailer. 4/4 confirmations across char-create + login flows. Server reuses 0x0839 with shorter S>C variants (1b ack, 7b name echo) — XML maps the opcode to OP_EnterWorld for log naming.</comment>
    </opcode>
    <opcode id="6bcf" name="OP_ExpansionInfo" updated="05/25/26">
        <comment>Which expansions user has. Live: 64b fixed S>C in the post-LogServer / pre-ApproveWorld handshake band (5/5 confirmations).</comment>
    </opcode>
    <opcode id="84f6" name="OP_SendCharInfo" updated="05/25/26">
        <comment>Send all chars visible @ char select. Live: 14176b S>C (variable with character roster size), fires once early in world handshake.</comment>
    </opcode>
    <opcode id="2de1" name="OP_SendSpellChecksum" updated="05/25/26">
        <comment>Contains a snippet of spell data. Live: 2056b C>S, payload tail shows caret-delimited spell-data text (matches spells_us.txt format). Capture-order position 2 of 4 in the post-handshake checksum burst.</comment>
    </opcode>
    <opcode id="44d9" name="OP_SendExeChecksum" updated="05/25/26">
        <comment>Client-side eqgame.exe checksum sample. Live: 2056b C>S, payload tail shows binary code-style content. Capture-order position 1 of 4 in the post-handshake checksum burst.</comment>
    </opcode>
    <opcode id="289c" name="OP_SendBaseDataChecksum" updated="05/25/26">
        <comment>Client-side base-data file sample. Live: 2056b C>S, payload tail shows caret-delimited text records. Capture-order position 3 of 4 in the post-handshake checksum burst. Mapping to BaseData (vs another text-format file) inferred by elimination + position.</comment>
    </opcode>
    <opcode id="a958" name="OP_SendSkillCapsChecksum" updated="05/25/26">
        <comment>Client-side skillcaps checksum. Live: 64b C>S, opaque hash-style payload. Capture-order position 4 of 4 in the post-handshake checksum burst — the only one not at 2056b, fits the smaller skillcaps data table.</comment>
    </opcode>
    <opcode id="bb67" name="OP_SetChatServer" updated="05/25/26">
        <comment>Legacy chatserver tuple. May be obsolete on Live — handshake capture shows only the SetChatServer2 catalog (no 56b S>C tuple observed, unlike Test).</comment>
    </opcode>
    <opcode id="f22b" name="OP_SetChatServer2" updated="05/25/26">
        <comment>Secondary chat / account / commerce service catalog. Live: 1464b S>C in handshake band (3/3 confirmations); ~18 plaintext Daybreak service URLs.</comment>
    </opcode>
    <opcode id="f21f" name="OP_ZoneServerInfo" updated="05/25/26">
        <comment>Zone server connection info. Live: 130b S>C, fires on world->zone handoff (zone server hostname + port). 2/2 confirmations.</comment>
        <payload dir="server" typename="zoneServerInfoStruct" sizechecktype="match"/>
    </opcode>
    <opcode id="fc46" name="OP_WorldComplete" updated="05/25/26">
        <comment>Client telling world server it is done. Live: 0b C>S, last C>S packet of session immediately after OP_ZoneServerInfo. World replies by disconnecting. 2/2 confirmations.</comment>
    </opcode>
    <opcode id="f768" name="OP_DeleteCharacter" updated="05/06/26">
        <comment>Delete character @ char select. Live: 68b C>S, name@offset 0. 1/1 confirmation (fired exactly when user deleted a freshly-created char).</comment>
    </opcode>
    <opcode id="b677" name="OP_CharacterCreate" updated="05/06/26">
        <comment>Create character @ char select. Live: 168b C>S, fires once per submitted creation right after OP_ApproveName response.</comment>
    </opcode>
    <opcode id="4451" name="OP_ApproveName" updated="05/06/26">
        <comment>Approving new character name @ char creation. Live: 84b C>S name candidate, 1b S>C status (taken vs available). 2/2 confirmations across reject + accept cycle.</comment>
    </opcode>
    <opcode id="ffff" name="OP_RandomNameGenerator">
        <comment>Returns a random name. May be obsolete on Live — repeated random-button presses during char creation produced no isolated wire request/response; names likely come pre-baked in char-select catalog dump.</comment>
    </opcode>
</seqopcodes>
